/dev
/dev/vboxnetctl
/dev/vboxdrvu
/dev/vboxdrv
/dev/loop11
/dev/vcsa7
/dev/vcs7
/dev/zvol
/dev/zvol/vault
/dev/zvol/vault/ext4
/dev/zvol/vault/pi
/dev/zvol/vault/pi/2018aug04-part1
/dev/zvol/vault/pi/2018aug04-part2
/dev/zvol/vault/pi/2018aug04
/dev/vault
/dev/vault/ext4
/dev/vault/pi
/dev/vault/pi/2018aug04-part1
/dev/vault/pi/2018aug04-part2
/dev/vault/pi/2018aug04
/dev/zd16
/dev/zd0p2
/dev/zd0p1
/dev/zd0
/dev/zfs
/dev/v4l
/dev/v4l/by-path
/dev/v4l/by-path/pci-0000:00:1a.0-usb-0:1.5:1.0-video-index0
/dev/v4l/by-id
/dev/v4l/by-id/usb-0021970415D4-D309-0A2639_Laptop_Integrated_Webcam_E4HD-video-index0
/dev/media0
/dev/video0
/dev/kvm
/dev/vboxusb
/dev/vboxusb/001
/dev/vboxusb/001/004
/dev/vboxusb/001/003
/dev/vboxusb/002
/dev/vboxusb/002/003
/dev/mei0
/dev/wmi
/dev/wmi/dell-smbios
/dev/freefall
/dev/loop10
/dev/loop9
/dev/loop8
/dev/snd
/dev/snd/hwC1D0
/dev/snd/pcmC1D7p
/dev/snd/pcmC1D3p
/dev/snd/controlC1
/dev/snd/by-path
/dev/snd/by-path/pci-0000:01:00.1
/dev/snd/by-path/pci-0000:00:1b.0
/dev/snd/hwC0D0
/dev/snd/pcmC0D0c
/dev/snd/pcmC0D0p
/dev/snd/controlC0
/dev/snd/seq
/dev/snd/timer
/dev/vhost-vsock
/dev/vhost-net
/dev/uhid
/dev/vhci
/dev/vfio
/dev/vfio/vfio
/dev/userio
/dev/btrfs-control
/dev/cuse
/dev/hugepages
/dev/mqueue
/dev/initctl
/dev/log
/dev/shm
/dev/autofs
/dev/vcsa6
/dev/vcs6
/dev/vcsa5
/dev/vcs5
/dev/vcsa4
/dev/vcs4
/dev/vcsa3
/dev/vcs3
/dev/vcsa2
/dev/vcs2
/dev/sdd9
/dev/sdd1
/dev/sdd
/dev/sg3
/dev/sdc4
/dev/sdc3
/dev/sdc2
/dev/sdc1
/dev/sdc
/dev/sg2
/dev/hidraw1
/dev/sdb4
/dev/sdb3
/dev/sdb2
/dev/sdb1
/dev/sdb
/dev/sg1
/dev/hidraw0
/dev/usb
/dev/usb/hiddev0
/dev/fw0
/dev/fb0
/dev/sda4
/dev/sda3
/dev/sda2
/dev/sda1
/dev/sda
/dev/bsg
/dev/bsg/3:0:0:0
/dev/bsg/2:0:0:0
/dev/bsg/1:0:0:0
/dev/bsg/0:0:0:0
/dev/sg0
/dev/i2c-14
/dev/drm_dp_aux2
/dev/i2c-13
/dev/drm_dp_aux1
/dev/disk
/dev/disk/by-partlabel
/dev/disk/by-partlabel/Basic\x20data\x20partition
/dev/disk/by-partlabel/EFI\x20System\x20Partition
/dev/disk/by-partlabel/EFI\x20system\x20partition
/dev/disk/by-partlabel/Microsoft\x20reserved\x20partition
/dev/disk/by-partlabel/zfs-e3cc284f008128bc
/dev/disk/by-label
/dev/disk/by-label/Recovery
/dev/disk/by-label/vault
/dev/disk/by-path
/dev/disk/by-path/pci-0000:00:1f.2-ata-3-part4
/dev/disk/by-path/pci-0000:00:1f.2-ata-3-part1
/dev/disk/by-path/pci-0000:00:1f.2-ata-3-part3
/dev/disk/by-path/pci-0000:00:1f.2-ata-3-part2
/dev/disk/by-path/pci-0000:00:1f.2-ata-1-part1
/dev/disk/by-path/pci-0000:00:1f.2-ata-1-part2
/dev/disk/by-path/pci-0000:00:1f.2-ata-2-part3
/dev/disk/by-path/pci-0000:00:1f.2-ata-2-part2
/dev/disk/by-path/pci-0000:00:1f.2-ata-2-part4
/dev/disk/by-path/pci-0000:00:1f.2-ata-1-part3
/dev/disk/by-path/pci-0000:00:1f.2-ata-1-part4
/dev/disk/by-path/pci-0000:00:1f.2-ata-4-part1
/dev/disk/by-path/pci-0000:00:1f.2-ata-4-part9
/dev/disk/by-path/pci-0000:00:1f.2-ata-4
/dev/disk/by-path/pci-0000:00:1f.2-ata-2-part1
/dev/disk/by-path/pci-0000:00:1f.2-ata-3
/dev/disk/by-path/pci-0000:00:1f.2-ata-2
/dev/disk/by-path/pci-0000:00:1f.2-ata-1
/dev/disk/by-uuid
/dev/disk/by-uuid/db19618a-6d05-4ac8-ae95-1a6dd71d065e
/dev/disk/by-uuid/1592-A48C
/dev/disk/by-uuid/6244635e-d75a-4186-b542-fc1c718441e6
/dev/disk/by-uuid/a498234e-79c7-4988-8b4b-a208fa12a983
/dev/disk/by-uuid/6A50DBB250DB836D
/dev/disk/by-uuid/CEDB-DBA3
/dev/disk/by-uuid/1ec205b0-a85c-4b63-9a09-d7ed9b2dab96
/dev/disk/by-uuid/DCD9-70DB
/dev/disk/by-uuid/8db0c4c7-487c-40cb-bd25-3a36c2d045f3
/dev/disk/by-uuid/6CB0DCCDB0DC9F40
/dev/disk/by-uuid/18290563346965817565
/dev/disk/by-partuuid
/dev/disk/by-partuuid/99ceb4f9-1016-4523-9018-37556bfa49a4
/dev/disk/by-partuuid/43977028-050d-434e-84a8-36ed1bdbf4a5
/dev/disk/by-partuuid/2b0e8b2d-a634-456d-be00-501c6b9e72cc
/dev/disk/by-partuuid/d0a39eb8-ae6c-4a23-8b65-6e13c0c89040
/dev/disk/by-partuuid/b1c4ba08-18e0-42f6-8c68-286df89645bf
/dev/disk/by-partuuid/3cf9af2e-2d8c-4c08-a3d2-c5f3da7e7dcf
/dev/disk/by-partuuid/ad4b7ece-0ed6-4c17-88af-0c3ab6b31feb
/dev/disk/by-partuuid/0dc2a40f-aafd-457c-836b-77071757f16e
/dev/disk/by-partuuid/c86d0459-bfe7-4fb0-b067-15812aa6a587
/dev/disk/by-partuuid/be9b2598-5f63-48f2-b66c-8da34b55efac
/dev/disk/by-partuuid/ef2766c0-2c68-49d6-ace1-d8dfa1aaac8b
/dev/disk/by-partuuid/1f7eaf53-8b0f-dd41-9806-362ec0a52c6b
/dev/disk/by-partuuid/fd68b49b-496f-5145-859e-1a4ac81ae316
/dev/disk/by-partuuid/b1190b3f-569a-4771-8132-bfeacf55d745
/dev/disk/by-id
/dev/disk/by-id/wwn-0x500a07510e66d81a-part4
/dev/disk/by-id/ata-Crucial_CT500MX200SSD3_15030E66D81A-part4
/dev/disk/by-id/wwn-0x500a07510e66d81a-part1
/dev/disk/by-id/ata-Crucial_CT500MX200SSD3_15030E66D81A-part1
/dev/disk/by-id/wwn-0x500a07510e66d81a-part3
/dev/disk/by-id/ata-Crucial_CT500MX200SSD3_15030E66D81A-part3
/dev/disk/by-id/wwn-0x500a07510e66d81a-part2
/dev/disk/by-id/ata-Crucial_CT500MX200SSD3_15030E66D81A-part2
/dev/disk/by-id/wwn-0x5002538d422a0537-part1
/dev/disk/by-id/ata-Samsung_SSD_850_EVO_500GB_S3PTNB0J817485W-part1
/dev/disk/by-id/wwn-0x5002538d422a0537-part2
/dev/disk/by-id/ata-Samsung_SSD_850_EVO_500GB_S3PTNB0J817485W-part2
/dev/disk/by-id/wwn-0x5002538d422a03d9-part3
/dev/disk/by-id/ata-Samsung_SSD_850_EVO_500GB_S3PTNB0J817355T-part3
/dev/disk/by-id/wwn-0x5002538d422a03d9-part2
/dev/disk/by-id/wwn-0x5002538d422a03d9-part4
/dev/disk/by-id/ata-Samsung_SSD_850_EVO_500GB_S3PTNB0J817355T-part2
/dev/disk/by-id/ata-Samsung_SSD_850_EVO_500GB_S3PTNB0J817355T-part4
/dev/disk/by-id/wwn-0x5002538d422a0537-part3
/dev/disk/by-id/ata-Samsung_SSD_850_EVO_500GB_S3PTNB0J817485W-part3
/dev/disk/by-id/wwn-0x5002538d422a0537-part4
/dev/disk/by-id/ata-Samsung_SSD_850_EVO_500GB_S3PTNB0J817485W-part4
/dev/disk/by-id/wwn-0x5002538d422d77e0-part1
/dev/disk/by-id/ata-Samsung_SSD_850_EVO_500GB_S3PTNF0J810657M-part1
/dev/disk/by-id/wwn-0x5002538d422d77e0-part9
/dev/disk/by-id/ata-Samsung_SSD_850_EVO_500GB_S3PTNF0J810657M-part9
/dev/disk/by-id/wwn-0x5002538d422d77e0
/dev/disk/by-id/ata-Samsung_SSD_850_EVO_500GB_S3PTNF0J810657M
/dev/disk/by-id/wwn-0x5002538d422a03d9-part1
/dev/disk/by-id/ata-Samsung_SSD_850_EVO_500GB_S3PTNB0J817355T-part1
/dev/disk/by-id/wwn-0x500a07510e66d81a
/dev/disk/by-id/ata-Crucial_CT500MX200SSD3_15030E66D81A
/dev/disk/by-id/wwn-0x5002538d422a03d9
/dev/disk/by-id/ata-Samsung_SSD_850_EVO_500GB_S3PTNB0J817355T
/dev/disk/by-id/wwn-0x5002538d422a0537
/dev/disk/by-id/ata-Samsung_SSD_850_EVO_500GB_S3PTNB0J817485W
/dev/i2c-12
/dev/drm_dp_aux0
/dev/dri
/dev/dri/by-path
/dev/dri/by-path/pci-0000:01:00.0-card
/dev/dri/by-path/pci-0000:01:00.0-render
/dev/dri/card0
/dev/dri/renderD128
/dev/i2c-11
/dev/i2c-10
/dev/i2c-9
/dev/i2c-8
/dev/i2c-7
/dev/i2c-6
/dev/i2c-5
/dev/i2c-4
/dev/i2c-3
/dev/i2c-2
/dev/i2c-1
/dev/i2c-0
/dev/ptp0
/dev/block
/dev/block/7:11
/dev/block/230:1
/dev/block/230:2
/dev/block/230:16
/dev/block/230:0
/dev/block/7:8
/dev/block/7:10
/dev/block/7:9
/dev/block/8:36
/dev/block/8:33
/dev/block/8:35
/dev/block/8:34
/dev/block/8:1
/dev/block/8:2
/dev/block/8:19
/dev/block/8:20
/dev/block/8:18
/dev/block/8:3
/dev/block/8:4
/dev/block/8:49
/dev/block/8:57
/dev/block/8:48
/dev/block/8:17
/dev/block/8:32
/dev/block/8:16
/dev/block/8:0
/dev/block/7:1
/dev/block/7:2
/dev/block/7:7
/dev/block/7:0
/dev/block/7:3
/dev/block/7:4
/dev/block/7:5
/dev/block/7:6
/dev/rtc
/dev/char
/dev/char/10:50
/dev/char/10:51
/dev/char/10:52
/dev/char/7:135
/dev/char/7:7
/dev/char/13:82
/dev/char/13:81
/dev/char/13:84
/dev/char/13:83
/dev/char/13:3
/dev/char/13:1
/dev/char/13:2
/dev/char/13:0
/dev/char/10:53
/dev/char/13:80
/dev/char/13:79
/dev/char/116:9
/dev/char/116:7
/dev/char/116:8
/dev/char/116:6
/dev/char/13:78
/dev/char/13:76
/dev/char/13:77
/dev/char/81:0
/dev/char/13:74
/dev/char/238:0
/dev/char/13:75
/dev/char/10:232
/dev/char/13:73
/dev/char/116:5
/dev/char/116:3
/dev/char/116:2
/dev/char/116:4
/dev/char/116:1
/dev/char/116:33
/dev/char/239:0
/dev/char/10:54
/dev/char/10:55
/dev/char/10:235
/dev/char/7:134
/dev/char/7:6
/dev/char/7:133
/dev/char/7:5
/dev/char/7:132
/dev/char/7:4
/dev/char/7:131
/dev/char/7:3
/dev/char/7:130
/dev/char/7:2
/dev/char/21:1
/dev/char/246:3
/dev/char/246:1
/dev/char/21:3
/dev/char/246:0
/dev/char/21:0
/dev/char/246:2
/dev/char/21:2
/dev/char/13:34
/dev/char/13:72
/dev/char/13:33
/dev/char/13:71
/dev/char/189:3
/dev/char/13:32
/dev/char/13:70
/dev/char/240:1
/dev/char/240:0
/dev/char/180:0
/dev/char/189:130
/dev/char/189:2
/dev/char/89:4
/dev/char/89:12
/dev/char/226:128
/dev/char/89:8
/dev/char/29:0
/dev/char/89:11
/dev/char/89:2
/dev/char/89:14
/dev/char/242:2
/dev/char/89:10
/dev/char/242:1
/dev/char/242:0
/dev/char/89:3
/dev/char/89:1
/dev/char/89:5
/dev/char/89:7
/dev/char/89:13
/dev/char/89:9
/dev/char/226:0
/dev/char/89:6
/dev/char/89:0
/dev/char/243:0
/dev/char/189:129
/dev/char/189:1
/dev/char/244:0
/dev/char/13:69
/dev/char/7:129
/dev/char/7:128
/dev/char/7:1
/dev/char/7:0
/dev/char/5:3
/dev/char/4:9
/dev/char/4:8
/dev/char/4:7
/dev/char/4:63
/dev/char/4:62
/dev/char/4:61
/dev/char/4:60
/dev/char/4:58
/dev/char/4:6
/dev/char/4:59
/dev/char/4:57
/dev/char/4:56
/dev/char/4:55
/dev/char/4:54
/dev/char/4:53
/dev/char/4:52
/dev/char/4:51
/dev/char/4:50
/dev/char/4:5
/dev/char/4:49
/dev/char/4:48
/dev/char/4:47
/dev/char/4:46
/dev/char/4:45
/dev/char/4:44
/dev/char/4:43
/dev/char/4:42
/dev/char/4:41
/dev/char/4:4
/dev/char/4:40
/dev/char/4:39
/dev/char/4:36
/dev/char/4:37
/dev/char/4:38
/dev/char/4:35
/dev/char/4:34
/dev/char/4:33
/dev/char/4:31
/dev/char/4:30
/dev/char/4:32
/dev/char/4:3
/dev/char/4:29
/dev/char/4:27
/dev/char/4:28
/dev/char/4:18
/dev/char/4:26
/dev/char/4:25
/dev/char/4:24
/dev/char/4:23
/dev/char/4:22
/dev/char/4:2
/dev/char/4:21
/dev/char/4:20
/dev/char/4:14
/dev/char/4:19
/dev/char/4:16
/dev/char/4:17
/dev/char/4:15
/dev/char/4:13
/dev/char/4:12
/dev/char/4:10
/dev/char/4:11
/dev/char/4:1
/dev/char/4:0
/dev/char/5:0
/dev/char/5:2
/dev/char/5:1
/dev/char/108:0
/dev/char/10:63
/dev/char/10:223
/dev/char/10:200
/dev/char/10:231
/dev/char/10:62
/dev/char/10:57
/dev/char/10:1
/dev/char/10:58
/dev/char/10:184
/dev/char/10:56
/dev/char/10:227
/dev/char/10:237
/dev/char/10:60
/dev/char/10:228
/dev/char/10:183
/dev/char/10:61
/dev/char/10:229
/dev/char/10:59
/dev/char/10:236
/dev/char/1:5
/dev/char/1:8
/dev/char/1:9
/dev/char/1:4
/dev/char/1:3
/dev/char/1:1
/dev/char/1:11
/dev/char/1:7
/dev/char/13:63
/dev/char/4:76
/dev/char/249:0
/dev/char/4:72
/dev/char/4:73
/dev/char/4:71
/dev/char/4:70
/dev/char/4:94
/dev/char/4:75
/dev/char/4:69
/dev/char/4:95
/dev/char/4:67
/dev/char/4:93
/dev/char/4:89
/dev/char/4:90
/dev/char/4:92
/dev/char/4:91
/dev/char/4:87
/dev/char/4:88
/dev/char/4:86
/dev/char/4:85
/dev/char/4:84
/dev/char/4:66
/dev/char/4:80
/dev/char/4:82
/dev/char/4:83
/dev/char/4:81
/dev/char/4:79
/dev/char/4:78
/dev/char/13:68
/dev/char/4:77
/dev/char/4:74
/dev/char/4:65
/dev/char/4:64
/dev/char/189:128
/dev/char/189:0
/dev/char/4:68
/dev/char/189:384
/dev/char/189:256
/dev/char/13:66
/dev/char/13:64
/dev/char/13:65
/dev/char/13:67
/dev/stderr
/dev/stdout
/dev/stdin
/dev/fd
/dev/core
/dev/pts
/dev/pts/2
/dev/pts/0
/dev/pts/4
/dev/pts/3
/dev/pts/ptmx
/dev/memory_bandwidth
/dev/network_throughput
/dev/network_latency
/dev/cpu_dma_latency
/dev/cpu
/dev/cpu/microcode
/dev/mcelog
/dev/mapper
/dev/mapper/control
/dev/rtc0
/dev/uinput
/dev/psaux
/dev/input
/dev/input/js3
/dev/input/event20
/dev/input/js2
/dev/input/event19
/dev/input/js1
/dev/input/event18
/dev/input/js0
/dev/input/event17
/dev/input/event16
/dev/input/event15
/dev/input/event14
/dev/input/by-id
/dev/input/by-id/usb-0021970415D4-D309-0A2639_Laptop_Integrated_Webcam_E4HD-event-if00
/dev/input/by-id/usb-Logitech_USB_Receiver-if02-event-mouse
/dev/input/by-id/usb-Logitech_USB_Receiver-if02-mouse
/dev/input/event13
/dev/input/event12
/dev/input/event11
/dev/input/event10
/dev/input/by-path
/dev/input/by-path/pci-0000:00:1a.0-usb-0:1.5:1.0-event
/dev/input/by-path/platform-PNP0C14:00-event
/dev/input/by-path/pci-0000:00:1a.0-usb-0:1.2:1.2-event-mouse
/dev/input/by-path/pci-0000:00:1a.0-usb-0:1.2:1.2-mouse
/dev/input/by-path/platform-i8042-serio-1-event-mouse
/dev/input/by-path/platform-i8042-serio-0-event-kbd
/dev/input/by-path/platform-i8042-serio-1-mouse
/dev/input/event9
/dev/input/event8
/dev/input/mouse2
/dev/input/event7
/dev/input/mouse1
/dev/input/event6
/dev/input/mouse0
/dev/input/event5
/dev/input/event4
/dev/input/event3
/dev/input/event2
/dev/input/event1
/dev/input/event0
/dev/input/mice
/dev/bus
/dev/bus/usb
/dev/bus/usb/004
/dev/bus/usb/004/001
/dev/bus/usb/003
/dev/bus/usb/003/001
/dev/bus/usb/002
/dev/bus/usb/002/003
/dev/bus/usb/002/002
/dev/bus/usb/002/001
/dev/bus/usb/001
/dev/bus/usb/001/004
/dev/bus/usb/001/003
/dev/bus/usb/001/002
/dev/bus/usb/001/001
/dev/ppp
/dev/net
/dev/net/tun
/dev/loop7
/dev/loop6
/dev/loop5
/dev/loop4
/dev/loop3
/dev/loop2
/dev/loop1
/dev/loop0
/dev/loop-control
/dev/lightnvm
/dev/lightnvm/control
/dev/hwrng
/dev/hpet
/dev/ttyprintk
/dev/ttyS4
/dev/ttyS31
/dev/ttyS30
/dev/ttyS29
/dev/ttyS28
/dev/ttyS27
/dev/ttyS26
/dev/ttyS25
/dev/ttyS24
/dev/ttyS23
/dev/ttyS22
/dev/ttyS21
/dev/ttyS20
/dev/ttyS19
/dev/ttyS18
/dev/ttyS17
/dev/ttyS16
/dev/ttyS15
/dev/ttyS14
/dev/ttyS13
/dev/ttyS12
/dev/ttyS11
/dev/ttyS10
/dev/ttyS9
/dev/ttyS8
/dev/ttyS7
/dev/ttyS6
/dev/ttyS5
/dev/ttyS3
/dev/ttyS2
/dev/ttyS1
/dev/ttyS0
/dev/ptmx
/dev/fuse
/dev/ecryptfs
/dev/snapshot
/dev/tty63
/dev/tty62
/dev/tty61
/dev/tty60
/dev/tty59
/dev/tty58
/dev/tty57
/dev/tty56
/dev/tty55
/dev/tty54
/dev/tty53
/dev/tty52
/dev/tty51
/dev/tty50
/dev/tty49
/dev/tty48
/dev/tty47
/dev/tty46
/dev/tty45
/dev/tty44
/dev/tty43
/dev/tty42
/dev/tty41
/dev/tty40
/dev/tty39
/dev/tty38
/dev/tty37
/dev/tty36
/dev/tty35
/dev/tty34
/dev/tty33
/dev/tty32
/dev/tty31
/dev/tty30
/dev/tty29
/dev/tty28
/dev/tty27
/dev/tty26
/dev/tty25
/dev/tty24
/dev/tty23
/dev/tty22
/dev/tty21
/dev/tty20
/dev/tty19
/dev/tty18
/dev/tty17
/dev/tty16
/dev/tty15
/dev/tty14
/dev/tty13
/dev/tty12
/dev/tty11
/dev/tty10
/dev/tty9
/dev/tty8
/dev/tty7
/dev/tty6
/dev/tty5
/dev/tty4
/dev/tty3
/dev/tty2
/dev/tty1
/dev/vcsa1
/dev/vcs1
/dev/vcsa
/dev/vcs
/dev/tty0
/dev/console
/dev/tty
/dev/kmsg
/dev/urandom
/dev/random
/dev/full
/dev/zero
/dev/port
/dev/null
/dev/mem
/dev/rfkill
/dev/vga_arbiter

Bus 002 Device 003: ID 8087:0025 Intel Corp. 
Device Descriptor:
  bLength                18
  bDescriptorType         1
  bcdUSB               2.00
  bDeviceClass          224 Wireless
  bDeviceSubClass         1 Radio Frequency
  bDeviceProtocol         1 Bluetooth
  bMaxPacketSize0        64
  idVendor           0x8087 Intel Corp.
  idProduct          0x0025 
  bcdDevice            0.02
  iManufacturer           0 
  iProduct                0 
  iSerial                 0 
  bNumConfigurations      1
  Configuration Descriptor:
    bLength                 9
    bDescriptorType         2
    wTotalLength          200
    bNumInterfaces          2
    bConfigurationValue     1
    iConfiguration          0 
    bmAttributes         0xe0
      Self Powered
      Remote Wakeup
    MaxPower              100mA
    Interface Descriptor:
      bLength                 9
      bDescriptorType         4
      bInterfaceNumber        0
      bAlternateSetting       0
      bNumEndpoints           3
      bInterfaceClass       224 Wireless
      bInterfaceSubClass      1 Radio Frequency
      bInterfaceProtocol      1 Bluetooth
      iInterface              0 
      Endpoint Descriptor:
        bLength                 7
        bDescriptorType         5
        bEndpointAddress     0x81  EP 1 IN
        bmAttributes            3
          Transfer Type            Interrupt
          Synch Type               None
          Usage Type               Data
        wMaxPacketSize     0x0040  1x 64 bytes
        bInterval               1
      Endpoint Descriptor:
        bLength                 7
        bDescriptorType         5
        bEndpointAddress     0x02  EP 2 OUT
        bmAttributes            2
          Transfer Type            Bulk
          Synch Type               None
          Usage Type               Data
        wMaxPacketSize     0x0040  1x 64 bytes
        bInterval               1
      Endpoint Descriptor:
        bLength                 7
        bDescriptorType         5
        bEndpointAddress     0x82  EP 2 IN
        bmAttributes            2
          Transfer Type            Bulk
          Synch Type               None
          Usage Type               Data
        wMaxPacketSize     0x0040  1x 64 bytes
        bInterval               1
    Interface Descriptor:
      bLength                 9
      bDescriptorType         4
      bInterfaceNumber        1
      bAlternateSetting       0
      bNumEndpoints           2
      bInterfaceClass       224 Wireless
      bInterfaceSubClass      1 Radio Frequency
      bInterfaceProtocol      1 Bluetooth
      iInterface              0 
      Endpoint Descriptor:
        bLength                 7
        bDescriptorType         5
        bEndpointAddress     0x03  EP 3 OUT
        bmAttributes            1
          Transfer Type            Isochronous
          Synch Type               None
          Usage Type               Data
        wMaxPacketSize     0x0000  1x 0 bytes
        bInterval               1
      Endpoint Descriptor:
        bLength                 7
        bDescriptorType         5
        bEndpointAddress     0x83  EP 3 IN
        bmAttributes            1
          Transfer Type            Isochronous
          Synch Type               None
          Usage Type               Data
        wMaxPacketSize     0x0000  1x 0 bytes
        bInterval               1
    Interface Descriptor:
      bLength                 9
      bDescriptorType         4
      bInterfaceNumber        1
      bAlternateSetting       1
      bNumEndpoints           2
      bInterfaceClass       224 Wireless
      bInterfaceSubClass      1 Radio Frequency
      bInterfaceProtocol      1 Bluetooth
      iInterface              0 
      Endpoint Descriptor:
        bLength                 7
        bDescriptorType         5
        bEndpointAddress     0x03  EP 3 OUT
        bmAttributes            1
          Transfer Type            Isochronous
          Synch Type               None
          Usage Type               Data
        wMaxPacketSize     0x0009  1x 9 bytes
        bInterval               1
      Endpoint Descriptor:
        bLength                 7
        bDescriptorType         5
        bEndpointAddress     0x83  EP 3 IN
        bmAttributes            1
          Transfer Type            Isochronous
          Synch Type               None
          Usage Type               Data
        wMaxPacketSize     0x0009  1x 9 bytes
        bInterval               1
    Interface Descriptor:
      bLength                 9
      bDescriptorType         4
      bInterfaceNumber        1
      bAlternateSetting       2
      bNumEndpoints           2
      bInterfaceClass       224 Wireless
      bInterfaceSubClass      1 Radio Frequency
      bInterfaceProtocol      1 Bluetooth
      iInterface              0 
      Endpoint Descriptor:
        bLength                 7
        bDescriptorType         5
        bEndpointAddress     0x03  EP 3 OUT
        bmAttributes            1
          Transfer Type            Isochronous
          Synch Type               None
          Usage Type               Data
        wMaxPacketSize     0x0011  1x 17 bytes
        bInterval               1
      Endpoint Descriptor:
        bLength                 7
        bDescriptorType         5
        bEndpointAddress     0x83  EP 3 IN
        bmAttributes            1
          Transfer Type            Isochronous
          Synch Type               None
          Usage Type               Data
        wMaxPacketSize     0x0011  1x 17 bytes
        bInterval               1
    Interface Descriptor:
      bLength                 9
      bDescriptorType         4
      bInterfaceNumber        1
      bAlternateSetting       3
      bNumEndpoints           2
      bInterfaceClass       224 Wireless
      bInterfaceSubClass      1 Radio Frequency
      bInterfaceProtocol      1 Bluetooth
      iInterface              0 
      Endpoint Descriptor:
        bLength                 7
        bDescriptorType         5
        bEndpointAddress     0x03  EP 3 OUT
        bmAttributes            1
          Transfer Type            Isochronous
          Synch Type               None
          Usage Type               Data
        wMaxPacketSize     0x0019  1x 25 bytes
        bInterval               1
      Endpoint Descriptor:
        bLength                 7
        bDescriptorType         5
        bEndpointAddress     0x83  EP 3 IN
        bmAttributes            1
          Transfer Type            Isochronous
          Synch Type               None
          Usage Type               Data
        wMaxPacketSize     0x0019  1x 25 bytes
        bInterval               1
    Interface Descriptor:
      bLength                 9
      bDescriptorType         4
      bInterfaceNumber        1
      bAlternateSetting       4
      bNumEndpoints           2
      bInterfaceClass       224 Wireless
      bInterfaceSubClass      1 Radio Frequency
      bInterfaceProtocol      1 Bluetooth
      iInterface              0 
      Endpoint Descriptor:
        bLength                 7
        bDescriptorType         5
        bEndpointAddress     0x03  EP 3 OUT
        bmAttributes            1
          Transfer Type            Isochronous
          Synch Type               None
          Usage Type               Data
        wMaxPacketSize     0x0021  1x 33 bytes
        bInterval               1
      Endpoint Descriptor:
        bLength                 7
        bDescriptorType         5
        bEndpointAddress     0x83  EP 3 IN
        bmAttributes            1
          Transfer Type            Isochronous
          Synch Type               None
          Usage Type               Data
        wMaxPacketSize     0x0021  1x 33 bytes
        bInterval               1
    Interface Descriptor:
      bLength                 9
      bDescriptorType         4
      bInterfaceNumber        1
      bAlternateSetting       5
      bNumEndpoints           2
      bInterfaceClass       224 Wireless
      bInterfaceSubClass      1 Radio Frequency
      bInterfaceProtocol      1 Bluetooth
      iInterface              0 
      Endpoint Descriptor:
        bLength                 7
        bDescriptorType         5
        bEndpointAddress     0x03  EP 3 OUT
        bmAttributes            1
          Transfer Type            Isochronous
          Synch Type               None
          Usage Type               Data
        wMaxPacketSize     0x0031  1x 49 bytes
        bInterval               1
      Endpoint Descriptor:
        bLength                 7
        bDescriptorType         5
        bEndpointAddress     0x83  EP 3 IN
        bmAttributes            1
          Transfer Type            Isochronous
          Synch Type               None
          Usage Type               Data
        wMaxPacketSize     0x0031  1x 49 bytes
        bInterval               1
    Interface Descriptor:
      bLength                 9
      bDescriptorType         4
      bInterfaceNumber        1
      bAlternateSetting       6
      bNumEndpoints           2
      bInterfaceClass       224 Wireless
      bInterfaceSubClass      1 Radio Frequency
      bInterfaceProtocol      1 Bluetooth
      iInterface              0 
      Endpoint Descriptor:
        bLength                 7
        bDescriptorType         5
        bEndpointAddress     0x03  EP 3 OUT
        bmAttributes            1
          Transfer Type            Isochronous
          Synch Type               None
          Usage Type               Data
        wMaxPacketSize     0x003f  1x 63 bytes
        bInterval               1
      Endpoint Descriptor:
        bLength                 7
        bDescriptorType         5
        bEndpointAddress     0x83  EP 3 IN
        bmAttributes            1
          Transfer Type            Isochronous
          Synch Type               None
          Usage Type               Data
        wMaxPacketSize     0x003f  1x 63 bytes
        bInterval               1
Device Status:     0x0001
  Self Powered

Bus 002 Device 002: ID 8087:0024 Intel Corp. Integrated Rate Matching Hub
Device Descriptor:
  bLength                18
  bDescriptorType         1
  bcdUSB               2.00
  bDeviceClass            9 Hub
  bDeviceSubClass         0 Unused
  bDeviceProtocol         1 Single TT
  bMaxPacketSize0        64
  idVendor           0x8087 Intel Corp.
  idProduct          0x0024 Integrated Rate Matching Hub
  bcdDevice            0.00
  iManufacturer           0 
  iProduct                0 
  iSerial                 0 
  bNumConfigurations      1
  Configuration Descriptor:
    bLength                 9
    bDescriptorType         2
    wTotalLength           25
    bNumInterfaces          1
    bConfigurationValue     1
    iConfiguration          0 
    bmAttributes         0xe0
      Self Powered
      Remote Wakeup
    MaxPower                0mA
    Interface Descriptor:
      bLength                 9
      bDescriptorType         4
      bInterfaceNumber        0
      bAlternateSetting       0
      bNumEndpoints           1
      bInterfaceClass         9 Hub
      bInterfaceSubClass      0 Unused
      bInterfaceProtocol      0 Full speed (or root) hub
      iInterface              0 
      Endpoint Descriptor:
        bLength                 7
        bDescriptorType         5
        bEndpointAddress     0x81  EP 1 IN
        bmAttributes            3
          Transfer Type            Interrupt
          Synch Type               None
          Usage Type               Data
        wMaxPacketSize     0x0002  1x 2 bytes
        bInterval              12
Hub Descriptor:
  bLength              11
  bDescriptorType      41
  nNbrPorts             8
  wHubCharacteristic 0x0009
    Per-port power switching
    Per-port overcurrent protection
    TT think time 8 FS bits
  bPwrOn2PwrGood       50 * 2 milli seconds
  bHubContrCurrent      0 milli Ampere
  DeviceRemovable    0x00 0x00
  PortPwrCtrlMask    0xff 0xff
 Hub Port Status:
   Port 1: 0000.0100 power
   Port 2: 0000.0100 power
   Port 3: 0000.0100 power
   Port 4: 0000.0100 power
   Port 5: 0000.0100 power
   Port 6: 0000.0103 power enable connect
   Port 7: 0000.0100 power
   Port 8: 0000.0100 power
Device Qualifier (for other device speed):
  bLength                10
  bDescriptorType         6
  bcdUSB               2.00
  bDeviceClass            9 Hub
  bDeviceSubClass         0 Unused
  bDeviceProtocol         0 Full speed (or root) hub
  bMaxPacketSize0        64
  bNumConfigurations      1
Device Status:     0x0001
  Self Powered

Bus 002 Device 001: ID 1d6b:0002 Linux Foundation 2.0 root hub
Device Descriptor:
  bLength                18
  bDescriptorType         1
  bcdUSB               2.00
  bDeviceClass            9 Hub
  bDeviceSubClass         0 Unused
  bDeviceProtocol         0 Full speed (or root) hub
  bMaxPacketSize0        64
  idVendor           0x1d6b Linux Foundation
  idProduct          0x0002 2.0 root hub
  bcdDevice            4.15
  iManufacturer           3 Linux 4.15.0-46-generic ehci_hcd
  iProduct                2 EHCI Host Controller
  iSerial                 1 0000:00:1d.0
  bNumConfigurations      1
  Configuration Descriptor:
    bLength                 9
    bDescriptorType         2
    wTotalLength           25
    bNumInterfaces          1
    bConfigurationValue     1
    iConfiguration          0 
    bmAttributes         0xe0
      Self Powered
      Remote Wakeup
    MaxPower                0mA
    Interface Descriptor:
      bLength                 9
      bDescriptorType         4
      bInterfaceNumber        0
      bAlternateSetting       0
      bNumEndpoints           1
      bInterfaceClass         9 Hub
      bInterfaceSubClass      0 Unused
      bInterfaceProtocol      0 Full speed (or root) hub
      iInterface              0 
      Endpoint Descriptor:
        bLength                 7
        bDescriptorType         5
        bEndpointAddress     0x81  EP 1 IN
        bmAttributes            3
          Transfer Type            Interrupt
          Synch Type               None
          Usage Type               Data
        wMaxPacketSize     0x0004  1x 4 bytes
        bInterval              12
Hub Descriptor:
  bLength               9
  bDescriptorType      41
  nNbrPorts             3
  wHubCharacteristic 0x000a
    No power switching (usb 1.0)
    Per-port overcurrent protection
  bPwrOn2PwrGood       10 * 2 milli seconds
  bHubContrCurrent      0 milli Ampere
  DeviceRemovable    0x02
  PortPwrCtrlMask    0xff
 Hub Port Status:
   Port 1: 0000.0503 highspeed power enable connect
   Port 2: 0000.0100 power
   Port 3: 0000.0100 power
Device Status:     0x0001
  Self Powered

Bus 001 Device 004: ID 0c45:6449 Microdia 
Device Descriptor:
  bLength                18
  bDescriptorType         1
  bcdUSB               2.00
  bDeviceClass          239 Miscellaneous Device
  bDeviceSubClass         2 ?
  bDeviceProtocol         1 Interface Association
  bMaxPacketSize0        64
  idVendor           0x0c45 Microdia
  idProduct          0x6449 
  bcdDevice           28.08
  iManufacturer           2 0021970415D4-D309-0A2639
  iProduct                1 Laptop_Integrated_Webcam_E4HD
  iSerial                 0 
  bNumConfigurations      1
  Configuration Descriptor:
    bLength                 9
    bDescriptorType         2
    wTotalLength          661
    bNumInterfaces          2
    bConfigurationValue     1
    iConfiguration          0 
    bmAttributes         0x80
      (Bus Powered)
    MaxPower              500mA
    ** UNRECOGNIZED:  28 ff 42 49 53 54 00 01 06 01 10 00 00 00 00 00 d1 10 f4 01 d2 11 f4 01 d3 12 f4 01 d4 13 f4 01 d5 14 f4 01 d6 15 f4 01
    Interface Association:
      bLength                 8
      bDescriptorType        11
      bFirstInterface         0
      bInterfaceCount         2
      bFunctionClass         14 Video
      bFunctionSubClass       3 Video Interface Collection
      bFunctionProtocol       0 
      iFunction               5 Integrated Webcam
    Interface Descriptor:
      bLength                 9
      bDescriptorType         4
      bInterfaceNumber        0
      bAlternateSetting       0
      bNumEndpoints           1
      bInterfaceClass        14 Video
      bInterfaceSubClass      1 Video Control
      bInterfaceProtocol      0 
      iInterface              5 Integrated Webcam
      VideoControl Interface Descriptor:
        bLength                13
        bDescriptorType        36
        bDescriptorSubtype      1 (HEADER)
        bcdUVC               1.00
        wTotalLength          103
        dwClockFrequency       15.000000MHz
        bInCollection           1
        baInterfaceNr( 0)       1
      VideoControl Interface Descriptor:
        bLength                 9
        bDescriptorType        36
        bDescriptorSubtype      3 (OUTPUT_TERMINAL)
        bTerminalID             5
        wTerminalType      0x0101 USB Streaming
        bAssocTerminal          0
        bSourceID               4
        iTerminal               0 
      VideoControl Interface Descriptor:
        bLength                26
        bDescriptorType        36
        bDescriptorSubtype      6 (EXTENSION_UNIT)
        bUnitID                 3
        guidExtensionCode         {7033f028-1163-2e4a-ba2c-6890eb334016}
        bNumControl             8
        bNrPins                 1
        baSourceID( 0)          2
        bControlSize            1
        bmControls( 0)       0x1f
        iExtension              0 
      VideoControl Interface Descriptor:
        bLength                26
        bDescriptorType        36
        bDescriptorSubtype      6 (EXTENSION_UNIT)
        bUnitID                 4
        guidExtensionCode         {c385b80f-c268-4745-90f7-8f47579d95fc}
        bNumControl             8
        bNrPins                 1
        baSourceID( 0)          3
        bControlSize            1
        bmControls( 0)       0x0f
        iExtension              0 
      VideoControl Interface Descriptor:
        bLength                18
        bDescriptorType        36
        bDescriptorSubtype      2 (INPUT_TERMINAL)
        bTerminalID             1
        wTerminalType      0x0201 Camera Sensor
        bAssocTerminal          0
        iTerminal               0 
        wObjectiveFocalLengthMin      0
        wObjectiveFocalLengthMax      0
        wOcularFocalLength            0
        bControlSize                  3
        bmControls           0x00000000
      VideoControl Interface Descriptor:
        bLength                11
        bDescriptorType        36
        bDescriptorSubtype      5 (PROCESSING_UNIT)
      Warning: Descriptor too short
        bUnitID                 2
        bSourceID               1
        wMaxMultiplier          0
        bControlSize            2
        bmControls     0x0000157f
          Brightness
          Contrast
          Hue
          Saturation
          Sharpness
          Gamma
          White Balance Temperature
          Backlight Compensation
          Power Line Frequency
          White Balance Temperature, Auto
        iProcessing             0 
        bmVideoStandards     0x 0
      Endpoint Descriptor:
        bLength                 7
        bDescriptorType         5
        bEndpointAddress     0x83  EP 3 IN
        bmAttributes            3
          Transfer Type            Interrupt
          Synch Type               None
          Usage Type               Data
        wMaxPacketSize     0x0010  1x 16 bytes
        bInterval               6
    Interface Descriptor:
      bLength                 9
      bDescriptorType         4
      bInterfaceNumber        1
      bAlternateSetting       0
      bNumEndpoints           0
      bInterfaceClass        14 Video
      bInterfaceSubClass      2 Video Streaming
      bInterfaceProtocol      0 
      iInterface              5 Integrated Webcam
      VideoStreaming Interface Descriptor:
        bLength                            15
        bDescriptorType                    36
        bDescriptorSubtype                  1 (INPUT_HEADER)
        bNumFormats                         2
        wTotalLength                      375
        bEndPointAddress                  129
        bmInfo                              0
        bTerminalLink                       5
        bStillCaptureMethod                 0
        bTriggerSupport                     0
        bTriggerUsage                       0
        bControlSize                        1
        bmaControls( 0)                    27
        bmaControls( 1)                    27
      VideoStreaming Interface Descriptor:
        bLength                            27
        bDescriptorType                    36
        bDescriptorSubtype                  4 (FORMAT_UNCOMPRESSED)
        bFormatIndex                        1
        bNumFrameDescriptors                6
        guidFormat                            {59555932-0000-1000-8000-00aa00389b71}
        bBitsPerPixel                      16
        bDefaultFrameIndex                  1
        bAspectRatioX                       0
        bAspectRatioY                       0
        bmInterlaceFlags                 0x00
          Interlaced stream or variable: No
          Fields per frame: 2 fields
          Field 1 first: No
          Field pattern: Field 1 only
          bCopyProtect                      0
      VideoStreaming Interface Descriptor:
        bLength                            46
        bDescriptorType                    36
        bDescriptorSubtype                  5 (FRAME_UNCOMPRESSED)
        bFrameIndex                         1
        bmCapabilities                   0x00
          Still image unsupported
        wWidth                            640
        wHeight                           480
        dwMinBitRate                 24576000
        dwMaxBitRate                147456000
        dwMaxVideoFrameBufferSize      614400
        dwDefaultFrameInterval         333333
        bFrameIntervalType                  5
        dwFrameInterval( 0)            333333
        dwFrameInterval( 1)            500000
        dwFrameInterval( 2)            666666
        dwFrameInterval( 3)           1000000
        dwFrameInterval( 4)           2000000
      VideoStreaming Interface Descriptor:
        bLength                            46
        bDescriptorType                    36
        bDescriptorSubtype                  5 (FRAME_UNCOMPRESSED)
        bFrameIndex                         2
        bmCapabilities                   0x00
          Still image unsupported
        wWidth                            352
        wHeight                           288
        dwMinBitRate                  8110080
        dwMaxBitRate                 48660480
        dwMaxVideoFrameBufferSize      202752
        dwDefaultFrameInterval         333333
        bFrameIntervalType                  5
        dwFrameInterval( 0)            333333
        dwFrameInterval( 1)            500000
        dwFrameInterval( 2)            666666
        dwFrameInterval( 3)           1000000
        dwFrameInterval( 4)           2000000
      VideoStreaming Interface Descriptor:
        bLength                            46
        bDescriptorType                    36
        bDescriptorSubtype                  5 (FRAME_UNCOMPRESSED)
        bFrameIndex                         3
        bmCapabilities                   0x00
          Still image unsupported
        wWidth                            320
        wHeight                           240
        dwMinBitRate                  6144000
        dwMaxBitRate                 36864000
        dwMaxVideoFrameBufferSize      153600
        dwDefaultFrameInterval         333333
        bFrameIntervalType                  5
        dwFrameInterval( 0)            333333
        dwFrameInterval( 1)            500000
        dwFrameInterval( 2)            666666
        dwFrameInterval( 3)           1000000
        dwFrameInterval( 4)           2000000
      VideoStreaming Interface Descriptor:
        bLength                            46
        bDescriptorType                    36
        bDescriptorSubtype                  5 (FRAME_UNCOMPRESSED)
        bFrameIndex                         4
        bmCapabilities                   0x00
          Still image unsupported
        wWidth                            176
        wHeight                           144
        dwMinBitRate                  2027520
        dwMaxBitRate                 12165120
        dwMaxVideoFrameBufferSize       50688
        dwDefaultFrameInterval         333333
        bFrameIntervalType                  5
        dwFrameInterval( 0)            333333
        dwFrameInterval( 1)            500000
        dwFrameInterval( 2)            666666
        dwFrameInterval( 3)           1000000
        dwFrameInterval( 4)           2000000
      VideoStreaming Interface Descriptor:
        bLength                            46
        bDescriptorType                    36
        bDescriptorSubtype                  5 (FRAME_UNCOMPRESSED)
        bFrameIndex                         5
        bmCapabilities                   0x00
          Still image unsupported
        wWidth                            160
        wHeight                           120
        dwMinBitRate                  1536000
        dwMaxBitRate                  9216000
        dwMaxVideoFrameBufferSize       38400
        dwDefaultFrameInterval         333333
        bFrameIntervalType                  5
        dwFrameInterval( 0)            333333
        dwFrameInterval( 1)            500000
        dwFrameInterval( 2)            666666
        dwFrameInterval( 3)           1000000
        dwFrameInterval( 4)           2000000
      VideoStreaming Interface Descriptor:
        bLength                            34
        bDescriptorType                    36
        bDescriptorSubtype                  5 (FRAME_UNCOMPRESSED)
        bFrameIndex                         6
        bmCapabilities                   0x00
          Still image unsupported
        wWidth                           1280
        wHeight                           720
        dwMinBitRate                 73728000
        dwMaxBitRate                147456000
        dwMaxVideoFrameBufferSize     1843200
        dwDefaultFrameInterval        1000000
        bFrameIntervalType                  2
        dwFrameInterval( 0)           1000000
        dwFrameInterval( 1)           2000000
      VideoStreaming Interface Descriptor:
        bLength                             6
        bDescriptorType                    36
        bDescriptorSubtype                 13 (COLORFORMAT)
        bColorPrimaries                     1 (BT.709,sRGB)
        bTransferCharacteristics            1 (BT.709)
        bMatrixCoefficients                 4 (SMPTE 170M (BT.601))
      VideoStreaming Interface Descriptor:
        bLength                            11
        bDescriptorType                    36
        bDescriptorSubtype                  6 (FORMAT_MJPEG)
        bFormatIndex                        2
        bNumFrameDescriptors                1
        bFlags                              0
          Fixed-size samples: No
        bDefaultFrameIndex                  1
        bAspectRatioX                       0
        bAspectRatioY                       0
        bmInterlaceFlags                 0x00
          Interlaced stream or variable: No
          Fields per frame: 1 fields
          Field 1 first: No
          Field pattern: Field 1 only
          bCopyProtect                      0
      VideoStreaming Interface Descriptor:
        bLength                            46
        bDescriptorType                    36
        bDescriptorSubtype                  7 (FRAME_MJPEG)
        bFrameIndex                         1
        bmCapabilities                   0x00
          Still image unsupported
        wWidth                           1280
        wHeight                           720
        dwMinBitRate                 73751560
        dwMaxBitRate                442509360
        dwMaxVideoFrameBufferSize     1843789
        dwDefaultFrameInterval         333333
        bFrameIntervalType                  5
        dwFrameInterval( 0)            333333
        dwFrameInterval( 1)            500000
        dwFrameInterval( 2)            666666
        dwFrameInterval( 3)           1000000
        dwFrameInterval( 4)           2000000
      VideoStreaming Interface Descriptor:
        bLength                             6
        bDescriptorType                    36
        bDescriptorSubtype                 13 (COLORFORMAT)
        bColorPrimaries                     1 (BT.709,sRGB)
        bTransferCharacteristics            1 (BT.709)
        bMatrixCoefficients                 4 (SMPTE 170M (BT.601))
    Interface Descriptor:
      bLength                 9
      bDescriptorType         4
      bInterfaceNumber        1
      bAlternateSetting       1
      bNumEndpoints           1
      bInterfaceClass        14 Video
      bInterfaceSubClass      2 Video Streaming
      bInterfaceProtocol      0 
      iInterface              0 
      Endpoint Descriptor:
        bLength                 7
        bDescriptorType         5
        bEndpointAddress     0x81  EP 1 IN
        bmAttributes            5
          Transfer Type            Isochronous
          Synch Type               Asynchronous
          Usage Type               Data
        wMaxPacketSize     0x0080  1x 128 bytes
        bInterval               1
    Interface Descriptor:
      bLength                 9
      bDescriptorType         4
      bInterfaceNumber        1
      bAlternateSetting       2
      bNumEndpoints           1
      bInterfaceClass        14 Video
      bInterfaceSubClass      2 Video Streaming
      bInterfaceProtocol      0 
      iInterface              0 
      Endpoint Descriptor:
        bLength                 7
        bDescriptorType         5
        bEndpointAddress     0x81  EP 1 IN
        bmAttributes            5
          Transfer Type            Isochronous
          Synch Type               Asynchronous
          Usage Type               Data
        wMaxPacketSize     0x0100  1x 256 bytes
        bInterval               1
    Interface Descriptor:
      bLength                 9
      bDescriptorType         4
      bInterfaceNumber        1
      bAlternateSetting       3
      bNumEndpoints           1
      bInterfaceClass        14 Video
      bInterfaceSubClass      2 Video Streaming
      bInterfaceProtocol      0 
      iInterface              0 
      Endpoint Descriptor:
        bLength                 7
        bDescriptorType         5
        bEndpointAddress     0x81  EP 1 IN
        bmAttributes            5
          Transfer Type            Isochronous
          Synch Type               Asynchronous
          Usage Type               Data
        wMaxPacketSize     0x0320  1x 800 bytes
        bInterval               1
    Interface Descriptor:
      bLength                 9
      bDescriptorType         4
      bInterfaceNumber        1
      bAlternateSetting       4
      bNumEndpoints           1
      bInterfaceClass        14 Video
      bInterfaceSubClass      2 Video Streaming
      bInterfaceProtocol      0 
      iInterface              0 
      Endpoint Descriptor:
        bLength                 7
        bDescriptorType         5
        bEndpointAddress     0x81  EP 1 IN
        bmAttributes            5
          Transfer Type            Isochronous
          Synch Type               Asynchronous
          Usage Type               Data
        wMaxPacketSize     0x0b20  2x 800 bytes
        bInterval               1
    Interface Descriptor:
      bLength                 9
      bDescriptorType         4
      bInterfaceNumber        1
      bAlternateSetting       5
      bNumEndpoints           1
      bInterfaceClass        14 Video
      bInterfaceSubClass      2 Video Streaming
      bInterfaceProtocol      0 
      iInterface              0 
      Endpoint Descriptor:
        bLength                 7
        bDescriptorType         5
        bEndpointAddress     0x81  EP 1 IN
        bmAttributes            5
          Transfer Type            Isochronous
          Synch Type               Asynchronous
          Usage Type               Data
        wMaxPacketSize     0x1320  3x 800 bytes
        bInterval               1
    Interface Descriptor:
      bLength                 9
      bDescriptorType         4
      bInterfaceNumber        1
      bAlternateSetting       6
      bNumEndpoints           1
      bInterfaceClass        14 Video
      bInterfaceSubClass      2 Video Streaming
      bInterfaceProtocol      0 
      iInterface              0 
      Endpoint Descriptor:
        bLength                 7
        bDescriptorType         5
        bEndpointAddress     0x81  EP 1 IN
        bmAttributes            5
          Transfer Type            Isochronous
          Synch Type               Asynchronous
          Usage Type               Data
        wMaxPacketSize     0x1400  3x 1024 bytes
        bInterval               1
Device Qualifier (for other device speed):
  bLength                10
  bDescriptorType         6
  bcdUSB               2.00
  bDeviceClass          239 Miscellaneous Device
  bDeviceSubClass         2 ?
  bDeviceProtocol         1 Interface Association
  bMaxPacketSize0        64
  bNumConfigurations      1
Device Status:     0x0002
  (Bus Powered)
  Remote Wakeup Enabled

Bus 001 Device 003: ID 046d:c52b Logitech, Inc. Unifying Receiver
Device Descriptor:
  bLength                18
  bDescriptorType         1
  bcdUSB               2.00
  bDeviceClass            0 (Defined at Interface level)
  bDeviceSubClass         0 
  bDeviceProtocol         0 
  bMaxPacketSize0         8
  idVendor           0x046d Logitech, Inc.
  idProduct          0xc52b Unifying Receiver
  bcdDevice           12.03
  iManufacturer           1 Logitech
  iProduct                2 USB Receiver
  iSerial                 0 
  bNumConfigurations      1
  Configuration Descriptor:
    bLength                 9
    bDescriptorType         2
    wTotalLength           84
    bNumInterfaces          3
    bConfigurationValue     1
    iConfiguration          4 RQR12.03_B0025
    bmAttributes         0xa0
      (Bus Powered)
      Remote Wakeup
    MaxPower               98mA
    Interface Descriptor:
      bLength                 9
      bDescriptorType         4
      bInterfaceNumber        0
      bAlternateSetting       0
      bNumEndpoints           1
      bInterfaceClass         3 Human Interface Device
      bInterfaceSubClass      1 Boot Interface Subclass
      bInterfaceProtocol      1 Keyboard
      iInterface              0 
        HID Device Descriptor:
          bLength                 9
          bDescriptorType        33
          bcdHID               1.11
          bCountryCode            0 Not supported
          bNumDescriptors         1
          bDescriptorType        34 Report
          wDescriptorLength      59
         Report Descriptors: 
           ** UNAVAILABLE **
      Endpoint Descriptor:
        bLength                 7
        bDescriptorType         5
        bEndpointAddress     0x81  EP 1 IN
        bmAttributes            3
          Transfer Type            Interrupt
          Synch Type               None
          Usage Type               Data
        wMaxPacketSize     0x0008  1x 8 bytes
        bInterval               8
    Interface Descriptor:
      bLength                 9
      bDescriptorType         4
      bInterfaceNumber        1
      bAlternateSetting       0
      bNumEndpoints           1
      bInterfaceClass         3 Human Interface Device
      bInterfaceSubClass      1 Boot Interface Subclass
      bInterfaceProtocol      2 Mouse
      iInterface              0 
        HID Device Descriptor:
          bLength                 9
          bDescriptorType        33
          bcdHID               1.11
          bCountryCode            0 Not supported
          bNumDescriptors         1
          bDescriptorType        34 Report
          wDescriptorLength     148
         Report Descriptors: 
           ** UNAVAILABLE **
      Endpoint Descriptor:
        bLength                 7
        bDescriptorType         5
        bEndpointAddress     0x82  EP 2 IN
        bmAttributes            3
          Transfer Type            Interrupt
          Synch Type               None
          Usage Type               Data
        wMaxPacketSize     0x0008  1x 8 bytes
        bInterval               2
    Interface Descriptor:
      bLength                 9
      bDescriptorType         4
      bInterfaceNumber        2
      bAlternateSetting       0
      bNumEndpoints           1
      bInterfaceClass         3 Human Interface Device
      bInterfaceSubClass      0 No Subclass
      bInterfaceProtocol      0 None
      iInterface              0 
        HID Device Descriptor:
          bLength                 9
          bDescriptorType        33
          bcdHID               1.11
          bCountryCode            0 Not supported
          bNumDescriptors         1
          bDescriptorType        34 Report
          wDescriptorLength      93
         Report Descriptors: 
           ** UNAVAILABLE **
      Endpoint Descriptor:
        bLength                 7
        bDescriptorType         5
        bEndpointAddress     0x83  EP 3 IN
        bmAttributes            3
          Transfer Type            Interrupt
          Synch Type               None
          Usage Type               Data
        wMaxPacketSize     0x0020  1x 32 bytes
        bInterval               2
Device Status:     0x0000
  (Bus Powered)

Bus 001 Device 002: ID 8087:0024 Intel Corp. Integrated Rate Matching Hub
Device Descriptor:
  bLength                18
  bDescriptorType         1
  bcdUSB               2.00
  bDeviceClass            9 Hub
  bDeviceSubClass         0 Unused
  bDeviceProtocol         1 Single TT
  bMaxPacketSize0        64
  idVendor           0x8087 Intel Corp.
  idProduct          0x0024 Integrated Rate Matching Hub
  bcdDevice            0.00
  iManufacturer           0 
  iProduct                0 
  iSerial                 0 
  bNumConfigurations      1
  Configuration Descriptor:
    bLength                 9
    bDescriptorType         2
    wTotalLength           25
    bNumInterfaces          1
    bConfigurationValue     1
    iConfiguration          0 
    bmAttributes         0xe0
      Self Powered
      Remote Wakeup
    MaxPower                0mA
    Interface Descriptor:
      bLength                 9
      bDescriptorType         4
      bInterfaceNumber        0
      bAlternateSetting       0
      bNumEndpoints           1
      bInterfaceClass         9 Hub
      bInterfaceSubClass      0 Unused
      bInterfaceProtocol      0 Full speed (or root) hub
      iInterface              0 
      Endpoint Descriptor:
        bLength                 7
        bDescriptorType         5
        bEndpointAddress     0x81  EP 1 IN
        bmAttributes            3
          Transfer Type            Interrupt
          Synch Type               None
          Usage Type               Data
        wMaxPacketSize     0x0001  1x 1 bytes
        bInterval              12
Hub Descriptor:
  bLength               9
  bDescriptorType      41
  nNbrPorts             6
  wHubCharacteristic 0x0009
    Per-port power switching
    Per-port overcurrent protection
    TT think time 8 FS bits
  bPwrOn2PwrGood       50 * 2 milli seconds
  bHubContrCurrent      0 milli Ampere
  DeviceRemovable    0x00
  PortPwrCtrlMask    0xff
 Hub Port Status:
   Port 1: 0000.0100 power
   Port 2: 0000.0103 power enable connect
   Port 3: 0000.0100 power
   Port 4: 0000.0100 power
   Port 5: 0000.0503 highspeed power enable connect
   Port 6: 0000.0100 power
Device Qualifier (for other device speed):
  bLength                10
  bDescriptorType         6
  bcdUSB               2.00
  bDeviceClass            9 Hub
  bDeviceSubClass         0 Unused
  bDeviceProtocol         0 Full speed (or root) hub
  bMaxPacketSize0        64
  bNumConfigurations      1
Device Status:     0x0001
  Self Powered

Bus 001 Device 001: ID 1d6b:0002 Linux Foundation 2.0 root hub
Device Descriptor:
  bLength                18
  bDescriptorType         1
  bcdUSB               2.00
  bDeviceClass            9 Hub
  bDeviceSubClass         0 Unused
  bDeviceProtocol         0 Full speed (or root) hub
  bMaxPacketSize0        64
  idVendor           0x1d6b Linux Foundation
  idProduct          0x0002 2.0 root hub
  bcdDevice            4.15
  iManufacturer           3 Linux 4.15.0-46-generic ehci_hcd
  iProduct                2 EHCI Host Controller
  iSerial                 1 0000:00:1a.0
  bNumConfigurations      1
  Configuration Descriptor:
    bLength                 9
    bDescriptorType         2
    wTotalLength           25
    bNumInterfaces          1
    bConfigurationValue     1
    iConfiguration          0 
    bmAttributes         0xe0
      Self Powered
      Remote Wakeup
    MaxPower                0mA
    Interface Descriptor:
      bLength                 9
      bDescriptorType         4
      bInterfaceNumber        0
      bAlternateSetting       0
      bNumEndpoints           1
      bInterfaceClass         9 Hub
      bInterfaceSubClass      0 Unused
      bInterfaceProtocol      0 Full speed (or root) hub
      iInterface              0 
      Endpoint Descriptor:
        bLength                 7
        bDescriptorType         5
        bEndpointAddress     0x81  EP 1 IN
        bmAttributes            3
          Transfer Type            Interrupt
          Synch Type               None
          Usage Type               Data
        wMaxPacketSize     0x0004  1x 4 bytes
        bInterval              12
Hub Descriptor:
  bLength               9
  bDescriptorType      41
  nNbrPorts             3
  wHubCharacteristic 0x000a
    No power switching (usb 1.0)
    Per-port overcurrent protection
  bPwrOn2PwrGood       10 * 2 milli seconds
  bHubContrCurrent      0 milli Ampere
  DeviceRemovable    0x00
  PortPwrCtrlMask    0xff
 Hub Port Status:
   Port 1: 0000.0503 highspeed power enable connect
   Port 2: 0000.0100 power
   Port 3: 0000.0100 power
Device Status:     0x0001
  Self Powered

Bus 004 Device 001: ID 1d6b:0003 Linux Foundation 3.0 root hub
Device Descriptor:
  bLength                18
  bDescriptorType         1
  bcdUSB               3.00
  bDeviceClass            9 Hub
  bDeviceSubClass         0 Unused
  bDeviceProtocol         3 
  bMaxPacketSize0         9
  idVendor           0x1d6b Linux Foundation
  idProduct          0x0003 3.0 root hub
  bcdDevice            4.15
  iManufacturer           3 Linux 4.15.0-46-generic xhci-hcd
  iProduct                2 xHCI Host Controller
  iSerial                 1 0000:00:14.0
  bNumConfigurations      1
  Configuration Descriptor:
    bLength                 9
    bDescriptorType         2
    wTotalLength           31
    bNumInterfaces          1
    bConfigurationValue     1
    iConfiguration          0 
    bmAttributes         0xe0
      Self Powered
      Remote Wakeup
    MaxPower                0mA
    Interface Descriptor:
      bLength                 9
      bDescriptorType         4
      bInterfaceNumber        0
      bAlternateSetting       0
      bNumEndpoints           1
      bInterfaceClass         9 Hub
      bInterfaceSubClass      0 Unused
      bInterfaceProtocol      0 Full speed (or root) hub
      iInterface              0 
      Endpoint Descriptor:
        bLength                 7
        bDescriptorType         5
        bEndpointAddress     0x81  EP 1 IN
        bmAttributes            3
          Transfer Type            Interrupt
          Synch Type               None
          Usage Type               Data
        wMaxPacketSize     0x0004  1x 4 bytes
        bInterval              12
        bMaxBurst               0
Hub Descriptor:
  bLength              12
  bDescriptorType      42
  nNbrPorts             4
  wHubCharacteristic 0x000a
    No power switching (usb 1.0)
    Per-port overcurrent protection
  bPwrOn2PwrGood       10 * 2 milli seconds
  bHubContrCurrent      0 milli Ampere
  bHubDecLat          0.0 micro seconds
  wHubDelay             0 nano seconds
  DeviceRemovable    0x00
 Hub Port Status:
   Port 1: 0000.02a0 5Gbps power Rx.Detect
   Port 2: 0000.02a0 5Gbps power Rx.Detect
   Port 3: 0000.02a0 5Gbps power Rx.Detect
   Port 4: 0000.02a0 5Gbps power Rx.Detect
Binary Object Store Descriptor:
  bLength                 5
  bDescriptorType        15
  wTotalLength           15
  bNumDeviceCaps          1
  SuperSpeed USB Device Capability:
    bLength                10
    bDescriptorType        16
    bDevCapabilityType      3
    bmAttributes         0x00
    wSpeedsSupported   0x0008
      Device can operate at SuperSpeed (5Gbps)
    bFunctionalitySupport   3
      Lowest fully-functional device speed is SuperSpeed (5Gbps)
    bU1DevExitLat          10 micro seconds
    bU2DevExitLat         512 micro seconds
Device Status:     0x0001
  Self Powered

Bus 003 Device 001: ID 1d6b:0002 Linux Foundation 2.0 root hub
Device Descriptor:
  bLength                18
  bDescriptorType         1
  bcdUSB               2.00
  bDeviceClass            9 Hub
  bDeviceSubClass         0 Unused
  bDeviceProtocol         1 Single TT
  bMaxPacketSize0        64
  idVendor           0x1d6b Linux Foundation
  idProduct          0x0002 2.0 root hub
  bcdDevice            4.15
  iManufacturer           3 Linux 4.15.0-46-generic xhci-hcd
  iProduct                2 xHCI Host Controller
  iSerial                 1 0000:00:14.0
  bNumConfigurations      1
  Configuration Descriptor:
    bLength                 9
    bDescriptorType         2
    wTotalLength           25
    bNumInterfaces          1
    bConfigurationValue     1
    iConfiguration          0 
    bmAttributes         0xe0
      Self Powered
      Remote Wakeup
    MaxPower                0mA
    Interface Descriptor:
      bLength                 9
      bDescriptorType         4
      bInterfaceNumber        0
      bAlternateSetting       0
      bNumEndpoints           1
      bInterfaceClass         9 Hub
      bInterfaceSubClass      0 Unused
      bInterfaceProtocol      0 Full speed (or root) hub
      iInterface              0 
      Endpoint Descriptor:
        bLength                 7
        bDescriptorType         5
        bEndpointAddress     0x81  EP 1 IN
        bmAttributes            3
          Transfer Type            Interrupt
          Synch Type               None
          Usage Type               Data
        wMaxPacketSize     0x0004  1x 4 bytes
        bInterval              12
Hub Descriptor:
  bLength               9
  bDescriptorType      41
  nNbrPorts             4
  wHubCharacteristic 0x000a
    No power switching (usb 1.0)
    Per-port overcurrent protection
    TT think time 8 FS bits
  bPwrOn2PwrGood       10 * 2 milli seconds
  bHubContrCurrent      0 milli Ampere
  DeviceRemovable    0x00
  PortPwrCtrlMask    0xff
 Hub Port Status:
   Port 1: 0000.0100 power
   Port 2: 0000.0100 power
   Port 3: 0000.0100 power
   Port 4: 0000.0100 power
Device Status:     0x0001
  Self Powered
 Virtual core pointer                    	id=2	[master pointer  (3)]
    Virtual core XTEST pointer              	id=4	[slave  pointer  (2)]
    Logitech M510                           	id=10	[slave  pointer  (2)]
    AlpsPS/2 ALPS DualPoint TouchPad        	id=14	[slave  pointer  (2)]
    AlpsPS/2 ALPS DualPoint Stick           	id=15	[slave  pointer  (2)]
 Virtual core keyboard                   	id=3	[master keyboard (2)]
     Virtual core XTEST keyboard             	id=5	[slave  keyboard (3)]
     Power Button                            	id=6	[slave  keyboard (3)]
     Video Bus                               	id=7	[slave  keyboard (3)]
     Power Button                            	id=8	[slave  keyboard (3)]
     Sleep Button                            	id=9	[slave  keyboard (3)]
     Laptop_Integrated_Webcam_E4HD:          	id=11	[slave  keyboard (3)]
     Dell WMI hotkeys                        	id=12	[slave  keyboard (3)]
     AT Translated Set 2 keyboard            	id=13	[slave  keyboard (3)]
